{"type":"config","v":3,"src":"phone","t":1760000000.0,"user_name":"Kori","name_aliases":["Kory","Corey"],"focus_mode":false,"belt_only_mode":false,"features":{"captions":true,"tone":true,"rings":true,"alerts":true,"belt":true},"alerts_enabled":{"doorbell":true,"name_called":true},"belt_strength":200}
